,text,topic
1472,"Some taxpayers accelerated their tax payments into December 2017 to head off the cap, inflating states’ calendar year-end tax collections.",taxes
1473,"A plausible explanation is that more borrowing made it possible for students to obtain more education, which led to higher earnings and a better capacity to pay off debt.",student debt
1474,"...we sounded the alarm in the early months of Trump’s presidency, when prime-time Fox News host Tucker Carlson began to experiment with segments that used euphemisms like “Western civilization” to package the idea that white people are inherently more civilized while people of color are a threat to national stability.",white nationalism
1475,He lied about matters large and small. He refused to shake House Speaker Nancy Pelosi's outstretched hand. He talked up a divisive culture war.,white nationalism
1476,"As the number of Americans eligible for the Medicaid low-income health insurance program grows through expansion under the Affordable Care Act (ACA), some states are aiming to trim the rolls by requiring recipients to work or satisfy related criteria. ",universal health care
1477,"Sen. Kamala Harris (D-CA), the Democratic Party nominee for vice president, told 60 Minutes on Sunday evening that she believed that President Trump is a racist.",islam
1478,"You need to keep a close eye on what your school is teaching because the left only wants to teach your kids to engage in loveless sex, the sanctity of abortion, why America is evil, that men are women and women are men, and that Global Warming is real. (It’s not.)",marriage equality
1479,"But, whether this switch constitutes a true win for the racist right or not, it’s clear that MAGA conservatives are highly attuned to how decisions are made in the White House and which positions they want to control.",gun control
1480,"Amid closed restaurants, quiet office buildings and canceled sporting events, the new normal has had its fair share of environmental effects, with some areas in the U.S. reporting significant improvements in air quality.",environment
1481,"Last year, Netflix threatened to pull production from Georgia following the state’s passage of the so-called “fetal heartbeat” bill on abortion.",marriage equality
1482,I think the presence of über-hawk John Bolton in the administration somewhat obscured Pompeo's Iran obsession.,islam
1483,"Beneath the lavish media praise, the trans movement is hiding a litany of self-annihilating logic and regressive attitudes that merit public conversation.",marriage equality
1484,"There may be pushback among Democrats. If so, I hope the ones doing the pushing will reconsider. We have treated our younger generations, and many older people, unjustly. The act of recognizing an injustice we hadn’t seen before makes us more human and refines us as moral beings.",student debt
1485,"Though his mother, Di-Anne, already had $40,000 in student loans from her own graduate school education, she has taken out $42,000 in Parent PLUS Loans for Aaron – and she had kept him in the dark about the cost.",student debt
1486,"U.S. President Donald Trump is doing well and is very healthy, White House adviser Kellyanne Conway told Fox News on Thursday, after a U.S. military official who worked at the White House was found to have been infected with the novel coronavirus.",trump presidency
1487,"Trump has kept it up ever since, instructing federal police to tear-gas peaceful protesters outside the White House on Monday evening to clear the area for his ludicrous photo-op holding a Bible in front of St. John’s Episcopal Church in Lafayette Square, a stunt that outraged the bishop who oversees that church.",trump presidency
1488,"Such rivals as House Speaker Nancy Pelosi and Senate Majority Leader Mitch McConnell saw overstepping in the name of climate change, a blown campaign rollout to even explain all of its aspirational aspects, and, more generally, a need to slap down an unruly first-year Democratic Socialist.",environment
1489,"In the dominant political fight in D.C., Donald Trump wants a giant wall along the U.S./Mexico border.",immigration
1490,"When the nation's highest civilian honor went to a right-wing media personality, it served as an oddly appropriate capstone to Trump's broader goals.",white nationalism
1491,"deadline for the U.S. Internal Revenue Service to turn President Donald Trump’s tax returns over to a congressional tax oversight committee expired on Tuesday without lawmakers receiving the documents, a committee aide said.",taxes
1492,"Rep. Alexandria Ocasio-Cortez (D-NY) has been an avid supporter of the “Green New Deal,” a plan that would take dramatic steps to curb the United States’ contribution to global climate change. ",environment
1493,It took President Donald Trump only 11 days in office to decide that Colorado's Neil Gorsuch deserved a lifetime appointment to the Supreme Court.,islam
1494,"Police and law enforcement officials killed at least 223 black Americans in the year after Kaepernick first began to protest, according to a HuffPost analysis of data compiled by The Washington Post and The Guardian.",black lives matter
1495,"The Affordable Care Act requires traditional health insurance plans to provide “minimal essential coverage,"" which includes preventive care, mental health care, substance abuse, maternity and more. ",universal health care
1496,"It’s a strange fact of our moment that President Trump has claimed to have “plans” (or “a method”) for annihilating millions of innocent people, possibly most of the population of Afghanistan.",islam
1497,We have to hear stump speeches and debate exchanges that relate to the rapidly deteriorating facts on the ground in this country — and not get hung up on the histrionics of how we got here.,universal health care
1498,"Demonstrations in Minneapolis, which began Tuesday and continued Wednesday, turned to violent confrontation as police fired tear gas canisters into crowds.",black lives matter
1499,"Pro-democracy dissidents in Cuba condemned the island’s “accredited journalists” — reporters from mainstream media outlets with Communist Party permission to work — for their silence in the wake of an increasingly violent wave of repression, the Spain-based Diario de Cuba reported on Tuesday.",vaccine
1500,"Microsoft has announced an ambitious effort to make voting secure, verifiable and subject to reliable audits by registering ballots in encrypted form so they can be accurately and independently tracked long after they are cast.",elections 2020
1501,"Vice President Mike Pence repeatedly made false claims about the Trump administration's coronavirus response as he dodged, interrupted and obfuscated through the vice presidential debate on Wednesday.",universal health care
1502,Jennifer Grey and Clarke Gregg split after 19 years of marriage but will 'remain close',marriage equality
1503,Notorious crimes committed by illegal aliens — such as the killing of Kate Steinle in 2015 — became national symbols of the lack of immigration enforcement and a general decline in the rule of law.,taxes
1504,The George Floyd protests against the police killing of this unarmed black man while in police custody and systemic racism are supported by Native American communities author and activist Gyasi Ross tells Joy Reid.,blm
1505,"Liberal economist and New York Times opinion writer Paul Krugman, in a scathing column this week, warns that extreme events like the wildfires that have been devastating Australia are a preview of things to come — and he stresses that right-wing politicians who deny the reality of climate change are as great a threat as the events themselves.",environment
1506,Lawmakers specifically said they want to protect women from facing unfair competition from men who claim to be transgender women.,sport
1507,"Women’s rights advocates were relieved late Monday when Senate Democrats blocked an extreme anti-choice bill from advancing to a floor debate—but were soon outraged by President Donald Trump’s lies about abortion care, as well as the corporate media for enabling his blatantly false characterization of the bill to stand.",abortion
1508,Democratic U.S. Rep. David Cicilline of Rhode Island eloquently blasted Republican Rep. Matt Gaetz of Florida during Wednesday’s House hearing on gun control.,gun control
1509,"Juneteenth, an annual U.S. holiday on June 19, has taken on greater significance this year following nationwide protests over police brutality and the deaths of George Floyd, Breonna Taylor, Rayshard Brooks and other African Americans.",blm
1510,New York City police officer arrested after apparent chokehold arrest,blm
1511,The American president’s threat to reverse that decision and impose the metals tariffs is the latest example of his mercurial approach to trade policy.,international politics and world news
1512,"Democrats and Republicans stood and applauded after Illinois Rep. Rodney Davis, the top Republican on the House Administration Committee, saluted Haaland for making history as the first Native American woman to preside over the chamber.",gender
1513,"Marcus Books in Oakland, California, has served the black community in the Bay Area with books by and about African Americans for the past 60 years.",black lives matter
1514,"During the same press conference, Trump defended the caravan of right-wingers that invaded Portland, Oregon, over the weekend for the obvious purpose of terrorizing the population, especially BLM protesters.",gun control
1515,"Ahead of the Nov. 3 election the Republican president is trailing in opinion polls to Biden, who has hammered Trump for his response to the protests and the pandemic.",blm
1516,"Yet the gender ideology is rapidly gaining power, aided by huge donations from wealthy individuals and medical companies.",gender
1517,"In the spring, the Trump administration’s Department of Health and Human Services unveiled a new policy designed to silence taxpayer-funded family planning clinics, preventing them from letting patients know about their abortion rights.",abortion
1518,"Following his arrest on July 6, 2019, financier Jeffrey Epstein pleaded not guilty to sex trafficking charges involving dozens of underage girls at his mansions on Manhattan’s Upper East Side and in Palm Beach, Florida. ",#metoo
1519,"America is likely to remain a relative manufacturing wasteland, as barren as Trump’s own ill-conceived ideas on trade.",international politics and world news
1520,"In 2016, Donald Trump fueled his improbable presidential victory with an arsenal of catch phrases designed to incite and excite the Fox News and Breitbart audience who live in fear of America’s diversity and inevitable demographic changes.",trump presidency
1521,"Just sitting outside for like fifteen minutes a day really helps ground me, but also helps me recognize that nature is still here, and it’s worth fighting for,” she said.",environment
1522,Student loans are having a perverse effect: The very debt that’s taken on to allow someone to pursue their ambitions can later morph into a burden that requires them to ditch those plans and grab any job that will just pay the bills.,student debt
1523,"During the campaign, it was clear that much of the momentum behind NeverTrump was driven by narcissism, as well as by self-interest. NeverTrump gambled on a Hillary Clinton victory, preparing to blame Trump supporters and hoping to take revenge.",trump presidency
1524,"In fact, it’s for this very reason that banning junk fees has been a key goal of the Biden administration’s competition agenda announced in his first year in office.",middle class
1525,"If they do win, Democrats have hinted at enacting the most sweeping left-wing agenda in American history: amnesty for illegal aliens, D.C. statehood, a dramatic expansion of Medicare, the packing of the Supreme Court, the elimination of the coal industry, an end to oil pipelines like the Keystone XL, new draconian gun controls, the regionalization of cities to minimize the independence of suburbs, ending the Electoral College, and reparations for slavery, among other radical ideas.",gun control
1526,"Everything will be Ukraine...""",international politics and world news
1527,“It is a crisis.,environment
1528,The deepening economic crisis triggered by nationwide lockdowns to slow the spread of the novel coronavirus was underscored by other data on Thursday showing worker productivity fell at its fastest pace in more than four years in the first quarter amid the largest drop in hours since 2009.,coronavirus
1529,A Guatemalan mom who says she sustained severe chemical burns and was sexually assaulted in front of her young daughter during a kidnapping in Mexico is asking the U.S. government to let her into the country while her asylum case plays out.,immigration
1530,The U.S. Justice Department has not disclosed what punishment it would seek if Gendron is convicted.,gun control
1531,"As Black Lives Matter rioters coursed through the city, Lightfoot attempted to lock the protesters out of the Loop area by raising the bridges over the Chicago River and blockading highway exits feeding into downtown.",marriage equality
1532,"There has been a surge in homophobic and transphobic commenting on social media in recent days, which included describing LGBT people as from “hell” and calling for them to be killed, according to Wilde.",blm
1533,"Earlier this month, US President Donald Trump said US special forces would be withdrawn from northern Syria, in what was widely seen as betrayal of the Kurds and a green light for a Turkish attack.",international politics and world news
1534,"Proponents of better compensation and labor rights for college athletes have hammered the NCAA on numerous fronts over the last decade, with federal lawsuits, attempts to unionize, legislation in statehouses and Congress, and new leagues that aim to compete for top-tier athletes by paying them more than the NCAA allows.",sport
1535,"Carlson warned if Trump was unsuccessful in efforts to restore order, he could lose the 2020 presidential election.",black lives matter
1536,"In the latest born-again-Kanye news, it’s been reported that the newly-saved rapper is headlining the prayer rally Awaken 2020, which will also be headed up by a bunch of Trump-supporting anti-LGBTQ rights fanatics.",marriage equality
1537,"The German Federal State of Baden-Wuerttemberg is seeking damages from Volkswagen after local authorities purchased VW diesel vehicles which now face bans in cities like Stuttgart, Frankfurter Allgemeine Zeitung said on Saturday.",environment
1538,A woman who was the victim of a brutal gang rape attack in 2007 has spoken out about her ordeal and her attacker not being deported thanks to passengers aboard his flight.,immigration
1539,To treat human beings as props when there’s a real danger of exposure increases the cruelty quotient.,immigration
1540,"As election results trickled in from New York showing he was leading 31-year veteran Democratic Representative Eliot Engel, Jamaal Bowman told supporters he was part of a movement to deconstruct a system that is “literally killing us.”",black lives matter
1541,"Disturbing footage of Muslim kids saying they would sacrifice themselves and kill for the ""army of Allah"" surfaced from an Islamic center in Philadelphia.",islam
1542,Both Pollak and McSally described recent and ongoing leftist-driven riots and violent protests as contemporary reminders of the importance of the Second Amendment.,gun control
1543,"Vaccine critics, for example, have long championed the false claim that vaccines cause autism, and that the Centers for Disease Control and Prevention has tried to cover up that information, Gorski said. ",vaccines
1544,The Trump administration has made it clear that abortion is neither health care nor family planning.,abortion
1545,Trade jobs such as electricians or carpenters are in demand and provide steady salaries. Policymakers shouldn’t deter students who know a good job when they see it.,student debt
1546,"Indeed, just this week, Donald Trump, who once said the climate crisis was a hoax concocted by the Chinese, marveled at cold temperatures throughout the Midwest, convinced that the frigid weather is evidence of … something.",environment
1547,"Also, decades of NRA propaganda have convinced people to associate guns with safety and, indeed, as the economy craters, the NRA is treating this crisis as another opportunity to sell guns to people.",gun control
1548,"However, there is evidence suggesting that having cops in schools can help perpetuate the school-to-prison pipeline ― the cycle in which students, particularly students of color, are pushed out of school and into the criminal justice system when school authorities criminalize student misbehavior.",gun control
1549,Trump has also repeatedly lied about important details regarding the COVID-19 outbreak.,vaccine
1550,"Trump was widely criticized after National Guard troops and other federal forces drove peaceful protesters from the area around the White House on Monday before he and other administration officials walked to a nearby church, which had been damaged the night before, to pose holding a BIble. ",trump presidency
1551,House Democrats’ Chinese coronavirus relief package bails out coastal millionaires and billionaires while ensuring big businesses are able to freely hire illegal aliens and visa overstayers over unemployed Americans.,middle class
1552,Here's how Trump is grifting the pandemic to give the rich another big tax cut,taxes
1553,"At around 10 a.m., however, Trump sent out a tweet that explicitly warned Israel against letting Rep. Omar and Rep. Tlaib in.",international politics and world news
1554,Video footage on Twitter showed cheering protesters in Raleigh taking down two Confederate statues with ropes and hanging one to a lamp post.,black lives matter
1555,"The liberal class, once again, served as pathetic cheerleaders and censors for a candidate and a political party that in Europe would be considered on the far-right. ",black lives matter
1556,"It's not just governments and international organizations that have lined up to express dismay at Trump's move. Experts, entrepreneurs and others have also been quick to condemn the announcement.",coronavirus
1557,"In fact, New York City Mayor Bill de Blasio announced in late June that he plans to cut the police budget by one billion dollars in the next city budget.",gun control
1558,"If vaccination as a mechanism works, that doesn’t mean that vaccines cannot be a health hazard depending on how they’re made.",vaccine
1559,"IRNA quoted the parliament’s speaker, Mohammad Bagher Ghalibaf, as saying that both Qom and Borujerd were “dealing with student poisonings”.",islam
1560,"The second thing to note is that it's nonetheless a terrifying development that will almost certainly lead to more violence, especially in light of what promises to be a chaotic but close election, where violent tactics and intimidation could affect the outcome.",gun control
1561,"The U.S. government has begun preparing to distribute the vaccines, including talking to private companies about developing technology to track their deployment and monitor who has received them.",vaccine
1562,"Taken together, these trends leave many young Americans feeling trapped. If they don’t go to college, they have little chance of getting a steady, well-paying job. If they do go to college they’ll be on the hook for tens of thousands of dollars in student loans.  ",student debt
1563,"Football supports Trump in its promotion of racial division, the crushing of dissent, and the spread of misinformation, inequality, and brutality.",sport
1564,"What this means is that in these particular countries, local law enforcement agree to not enforce anti-gun laws, especially dangerous radical ones like confiscation, bans, mandatory registration, and limiting the size of magazines.",gun control
1565,"Just days after Missouri Gov. Mike Parson signed a bill that bans abortions at or beyond the eighth week of pregnancy, Planned Parenthood said the state threatened to not renew its license for the state's lone abortion clinic.",abortion
1566,"The Pro Football Hall of Fame's Centennial class of 2020 is set, and among the 15 honorees selected was former NFL commissioner Paul Tagliabue, who helped lead the league to new heights during his tenure from 1989-2006.",sport
1567,"Prominent black conservatives are seeing how the mainstream media are using the death of George Floyd  — to portray America as racist, to vilify all police officers, to force the mantle of victimhood onto black Americans — and they are calling foul.",black lives matter
1568,"Semenya, a two-time Olympic champion in the 800 meters, will now be forced to medicate to suppress her testosterone levels if she wants to defend her world title in September in Doha, Qatar.",sport
1569,The governor even increased the state's corrections budget to handle what he expects to be a higher number of incarcerations due to new gun laws.,gun control
1570,The measure would prevent U.S. graduates from getting hundreds of thousands of college-grade jobs as the foreign workers’ visas expire — despite the colossal job losses being caused by China’s Wuhan virus.,universal health care
1571,"The progressive push to bend Americans’ attitudes and their male-and-female civic society around the idea of “gender identity” has already attacked and cracked many of the popular social rules that help Americans manage the cooperation and competition among and between complementary, different, and equal men and women.",gender
1572,"Trump has been eager to paint the entire Democratic field as socialists, seeking to make any eventual nominee unsavory for voters by arguing Democrats want to raise taxes, open the U.S. borders and take away private healthcare.",taxes
1573,"An Iranian student traveling to East Lansing, Michigan, to start his first week at Michigan State University was forced by federal agents to return to his home country.",islam
1574,Trump’s evangelical cabal are behind Republican attacks on women’s reproductive rights.,gender
1575,President Donald Trump clearly wasn’t pleased on Wednesday when he learned that his former Defense Secretary James Mattis had spoken out against him. So the president responded in his usual and predictable way: lashing out on Twitter.,trump presidency
1576,"World leaders and organisations pledged $8 billion to fund a possible vaccine and treatments, many hoping explicitly to ensure that no country on Earth would be left out, but the United States did not contribute.",vaccine
1577,"Betsey Stevenson, an economics professor at the University of Michigan and another of the signatories on the Warren funding letter, said Warren’s plan shows it is possible to pay for Medicare for All without raising middle class taxes.",taxes
1578,"Pelosi’s coronavirus plan uses the pandemic to cram provisions of the House Democrats’ H.R. 1 legislation into federal law. That legislation went even further in its efforts to create loopholes for voter fraud, allowing convicted felons to vote in federal elections.",elections 2020
1579,"The result is that at a time when the United States is facing another public reckoning over civil rights abuses by police, the Justice Department unit charged with handling such problems has remained largely sidelined.",black lives matter
1580,"According to the latest polling, Biden retains the edge in most of the key general election battleground states, but his advantage is narrowing.",vaccine
1581,Anti-vaccine groups take dangerous online harassment into the real world,vaccines
1582,"Yet bizarrely, the entirety of the Establishment — from Prime Minister Boris Johnson downwards — and the bodies representing every cultural institution from the Church of England to the Football Association, have been grovelling and fawning and kowtowing to BLM as if its name were to be taken at face value.",marriage equality
1583,Obama’s joke about moat with alligators came to mind while reading a newly published report from the New York Times on Donald Trump’s zealotry on border policy.,immigration
1584,"For the first time the annual risk report, compiled by the World Economic Forum (WEF), found the top five concerns were all environmental, from extreme weather to biodiversity loss and events like oil spills and radioactive contamination.",environment
1585,"The wealthy are quite reasonably reluctant to give away more of their money than they have to and would simply move to more tax friendly jurisdictions, thus meaning the governments in high tax jurisdictions would have less to spend on worthy projects.",middle class
1586,Union leaders met with senior congressional Democrats to discuss aid after a proposal from the Republican-led U.S. Senate on Tuesday for additional coronavirus relief did not include new government assistance for U.S. airlines or airports.,vaccine
1587,Manhattan District Attorney Cy Vance Jr. announced a policy change regarding people arrested at Black Lives Matter protests on charges of unlawful assembly and disorderly conduct.,blm
1588,"Several congressional Democrats have introduced bills legitimizing the idea of a universal “right” to reproductive technologies including surrogacy, including for men who present themselves as women or gay men, who cannot reproduce without a woman.",abortion
1589,There were some shouting matches and scuffles outside the event between around 30 Black Lives Matter demonstrators and some Trump supporters waiting to enter.,blm
1590,Trump criticized Biden as too far left for Americans and warned that the Democrat’s efforts to battle the coronavirus would endanger the economy.,vaccine
