,text,topic
738,"She’s not the only one pushing the talking point, either.)",abortion
739,"Thousands of protesters gathered on Saturday in cities across Australia, shouting slogans in support of the Black Lives Matter movement and aiming to raise awareness of the mistreatment of indigenous people.",black lives matter
740,"Bryce Harper, who signed the richest free-agent contract in baseball history, a cool $330 million, was being unveiled for the first time in a Phillies uniform.",sport
741,People seem to think that the coronavirus mania has gone away.,vaccine
742,In one of his his most recent lies President Donald Trump now says he’s always known and felt the coronavirus crisis is a pandemic.,vaccine
743,Trump had repeatedly called for the replacement of Obamacare during his 2016 presidential campaign.,universal health care
744,"Amid the wave of racial justice protests, New York’s governor on Wednesday signed an executive order to recognize Juneteenth as an official holiday for state employees.",blm
745,"Police returned fire and wounded the suspect, and he was hospitalized thereafter.",gun control
746,"But the Christian Right embodies a dangerous form of Christianity that is bitterly anti-science, and its ideology goes hand in hand with white nationalism and the coronavirus truther movement.",white nationalism
747,"The narrative of the 1619 Project will inevitably lead impressionable children, likely to remain unexposed to competing evidence, to arrive at the same hate-filled conclusions about America.",marriage equality
748,"Research shows combining vaccine misinformation with alternative medicine, homeopathy and diet content this way is one of the most pervasive and persuasive techniques used by anti-vaccination advocates to forward their agenda.",vaccines
749,"Over 70,000 women in Germany have been subjected to female genital mutilation (FGM), and a further 17,000 young girls are at risk of having the barbaric procedure being committed against them.",gender
750,"Last month, Cuomo signed an executive order that included a statewide ban on chokeholds and an appointment of a special prosecutor to review cases of police killing unarmed individuals.",marriage equality
751,"A Joe Biden presidency could reset ties with top U.S. trade partner Mexico that have suffered since Donald Trump made his first White House bid, tarring Mexican migrants as rapists and gun-runners and vowing to keep them out with a border wall.",gun control
752,"Never before have the freewheeling inclinations of some Electoral College members flipped an election, so the impact of the high court's decision may be just mathematical.",elections 2020
753,That abortion is such a central component of the UN response to the COVID-19 emergency undermines the Trump administration’s pro-life foreign policy.,marriage equality
754,Young female athletes’ dreams and accomplishments have been dashed across the country when competing against biological males who “identify” as females.,marriage equality
755,"The government urged unvaccinated families to hang a red cloth or flag outside homes as a signal for help, and imposed the shutdown to free up resources for its vaccine drive and keep even those fearful of vaccines home for the teams’ visits.",vaccines
756,"Republicans argued that children need a parent's permission to go on a school field trip and can't go to an R-rated movie without a parent or guardian, so it makes no sense to make a life-altering decision about abortion on their own.",abortion
757,"""My social media is in my personal capacity,"" Shogan replied again.",elections 2020
758,"President Trump's two-day visit to India turned to substance Tuesday after opening with a heavy dose of pomp and pageantry, but few concrete accomplishments were expected from the whirlwind trip.",international politics and world news
759,"After more than a week of George Floyd protests, thousands of New Yorkers gathered Saturday for another day of demonstrations against police brutality and racial equality in the U.S.",marriage equality
760,President Donald Trump on Friday announced that he has waived interest payments on all federal student loans to help alleviate financial strain as the United States combats the spread of the coronavirus.,student debt
761,Trump's payroll tax ploy ploy endangers Social Security — and it will have to be paid back next year,taxes
762,"Indeed, as an aside, one wonders what Obama’s vice president, Joe Biden, thinks of all this: Has he learned the lesson of Iraq and other quagmires?  Has he rethought trade with China? Those are certainly good questions to be answered during the remainder of the 2020 campaign season.  ",taxes
763,"The film studios behind the Harry Potter franchise, Warner Bros., has weighed in on comments made by author J.K. Rowling that biological sex is a real thing and must be respected for the sake of women’s rights.",marriage equality
764,Morrison is a typical right-wing conservative who is in thrall to the energy sector of his country's economy. ,black lives matter
765,"The idea behind the conspiracy is that these miracle vaccines — and they are medical miracles — can cause autism, when there is no data to back that up.",vaccines
766,"In an echo of her iconic 1995 speech in Beijing as First Lady, where she declared that ""human rights are women's rights and women's rights are human rights,"" Secretary of State Hillary Rodham Clinton delivered a speech on Dec. 6, 2011, to the United Nations declaring, ""Gay rights are human rights, and human rights are gay rights.""",gender
767,"The growing number of coronavirus cases, including 26 deaths, coupled with plummeting oil prices led to the Dow Jones industrial average diving 19% from its all-time high three weeks ago.",coronavirus
768,Social media users were quick to point out the interactions and slammed McGuire for appearing to undermine Coyne Schofield’s hockey skills.,sport
769,Yet it's merely the tip of the iceberg of war criminals lurking -- and working -- on U.S. turf.,immigration
770,Donald Trump signed an executive order for this deferral and said he had plans to eliminate the tax altogether. ,taxes
771,"Anticipating pushback from anti-LGBTQ groups over this monumental achievement, HRC worked to keep the newly awarded rights legal.",marriage equality
772,YouTube is making clear there will be no “birtherism” on its platform during this year’s U.S. presidential election – a belated response to a type of conspiracy theory more prevalent in the 2012 race.,elections 2020
773,"Bizarrely, Abbott declared he was focused not on preventing infections but on making sure there were enough hospital beds for those who get infected. ",universal health care
774,"Furthermore, the president has repeatedly and infamously made sweeping, overtly bigoted comments about minority populations",islam
775,"The absurd Democratic talking point that Portland’s violence was created by federal officers is crumbling as local police, not feds, declare riot after riot, night after night in the City of Roses.",vaccine
776,His confidence in his sense of humor is the same confidence Donald Trump displayed when he called COVID-19 the “kung-flu” and mocked the accent of Asian world leaders.,white nationalism
777,The city of Cape Town has partnered with the Department of Water and Sanitation to distribute 41 million liters of water into informal settlements to aid handwashing to stem the virus spread.,blm
778,"“You know, there’s over 100 million people with preexisting conditions,” he said, claiming, “They weren’t able to get insurance before; now they cannot be denied insurance.”",universal health care
779,"Floyd, 46, was killed in police custody in Minneapolis, Minnesota, on Memorial Day, setting off nationwide protests and riots and reinvigorating the Black Lives Matter movement.",black lives matter
780,"Across the United States, legislators are attempting to pass laws forcing parents to vaccinate their children and/or removing existing exemptions from current vaccine laws.",vaccines
781,The doctor explained that two medicines that would be mailed to Ms. Dale would halt her pregnancy and cause a miscarriage.,abortion
782,"The stuff, beyond military toys to make Trump happy, include an increase in business tax deductions for meals and entertainment. ",taxes
783,An internationally known virologist with a military background explained to Breitbart News the United States is vulnerable to potential pandemics due to production of vaccines overseas and a lack of interest in making significant changes to the National Pandemic Plan.,vaccines
784,"An organization backed by Saudi Arabia accused several foreign countries of inciting young women to reject their families, the first public comments from Riyadh since a woman claiming domestic abuse was granted asylum in Canada over the weekend.",gender
785,His lawyers have sought a plea deal relating to these in an effort to avoid a possible death sentence.,gun control
786,"The anti-vaccination community holds to an unscientific conspiracy theory that childhood vaccinations are toxic and cause numerous illnesses and injuries, including autism, and spreads these beliefs through YouTube, Facebook and other online platforms.",vaccines
787,The dumbest person alive': Video reveals how painfully and dangerously wrong Trump has been about the coronavirus,vaccine
788,"The devil is in the details, however, since—while some charter schools are effective in achieving student success—others have been examples of cronyism and corruption as a result of arrangements between politicians and private businesses.",student debt
789,Egyptian lawmakers have called for stricter surveillance of women on video sharing apps after the arrests of a popular social media influencer and a well-known belly dancer on charges of debauchery and inciting immorality.,#metoo
790,"Since Wall Street hucksters crashed our economy about a decade ago, it's been increasingly clear that the American majority of middle-class and poor families is being intentionally crushed by corporate and governmental decisions imposed by plutocratic elites, creating an untenable, ever-widening level of inequality.",marriage equality
791,"Now that the Supreme Court has ruled on Texas' ridiculous suit against four other states, perhaps we can take stock of what's happened over the past few weeks.",black lives matter
792,"On Friday, Trump claimed he had reached a landmark last-minute immigration deal with Mexico, which meant he no longer had to impose the tariffs he had been threatening, part of his incoherent southern-border policy.",international politics and world news
793,"President Donald Trump in an interview on Tuesday mocked former Vice President Joe Biden for continuing to wear a mask. The president pointed to a speech that Biden gave on Tuesday about race relations, where the former vice president removed his mask.",elections 2020
794,"That’s because while these problems have been centuries in the making from slavery to Jim Crow to Ferguson and beyond, Donald Trump’s particular failings as a person and a candidate are fanning the flames of the crisis.",elections 2020
795,The left-wing Antifa and Black Lives Matter terrorists will probably try to attack the suburbs and Rural America in an indirect way — going after power stations and the like.,marriage equality
796,"Critical education has now turned into indoctrination on critical race theory. Some 4,500 classrooms have adopted the New York Times’ anti-American “1619 Project” into their curricula.",vaccine
797,"Ocasio-Cortez, who beat a top Democrat in New York in the 2018 midterm elections, has since become the face of the “Squad,” freshman Democrats aiming to move the party farther left on issues such as healthcare and climate change.",universal health care
798,Trump credits his administration’s efforts to deregulate industries and cut taxes for a bullish stock market and a historically low unemployment rate.,taxes
799,The ideas promoted by anti-vaccination groups — which rely on pseudoscience and conspiracy theories about the government and pharmaceutical companies — are false.,vaccines
800,The new judges are picked by Trump’s attorney general and cannot be blocked by hostile Democrats.,black lives matter
801,Gwyneth Paltrow’s new Goop Lab on Netflix is a sleazy infomercial for her pseudoscience empire,vaccine
802,"Women in power must pay a significant tax on their limited time to sit for manicures, blowouts, brow waxes, and braids, rather than meeting with constituents, reviewing legislation, conducting investigations, chasing a story, traveling to their districts, reviewing their notes, or spending time with their families.",gender
803,"Now that most of America has begun opening back up without the predicted spikes in coronavirus and Joe Biden has left his basement bunker, Americans are remembering that there’s an election going on. As normalcy quickly returns some places, so to has the battle for 1600 Pennsylvania Avenue.",elections 2020
804,The Senate passed a resolution late Thursday making sexual harassment training mandatory for everyone working in Congress' upper chamber.,#metoo
805,Winston Churchill was a ‘racist’. Or so the Black Lives Matter graffiti says on the plinth of his statue in London’s Parliament Square which is bound to be pulled down by hard-left activists sooner or later because the police don’t seem to have that much of an appetite to save it.,marriage equality
806,Nobel laureate Paul Krugman breaks down Trump's anti-working class agenda,universal health care
807,"While education is incredibly important and being well-educated is typically an ingredient of success, there are a few misconceptions that need to be addressed.",student debt
808,"On January 20, 2020, thousands upon thousands of Virginians descended upon Richmond to oppose Northam’s gun control push.",gun control
809,"Since January 2017, Trump has volleyed on healthcare often spewing lies about forthcoming release dates for his plan. ",universal health care
810,U.S. civil rights groups have enlisted the multinationals to help pressure the social media giant into taking concrete steps to block hate speech in the wake of the death of George Floyd and amid a national reckoning over racism.,blm
811,"Nevertheless, The Jesus Is King crooner launched his presidential campaign on Sunday in South Carolina where he railed against progressive policies such as abortion and gun control.",gun control
812,Members of the German Green Party have proposed that so-called “climate refugees” should be allowed to move to the country and receive a German passport upon their arrival.,environment
813,"Oxford chose ""climate emergency"" as the word of the year from a short list of words that were all related to the environment, such as climate crisis, eco-anxiety, ecocide, global heating and climate action.",environment
814,"Regardless of the chatter and ongoing analysis from political pundits, commentators, and officials, Harris has a well-documented record of embracing radical progressive ideas, touting them herself on numerous occasions.",gun control
815,Free trade has helped gut working and middle class American jobs and stripped whole middle American towns of their industries and livelihoods.,middle class
816,"The delusional leftists arguing that adoption is more “traumatic” than abortion aren’t making a convincing argument for their brutal baby death cult, but they are making a great point against the rise of surrogacy as a means for clients such as gay and “transgender” males to achieve their personal parenting fantasies.",abortion
817,"The Dow Jones Industrial Average just dropped nearly 1,200 points in a single day because of the coronavirus’s impact on global trade, leaving many Americans sick with worry.",taxes
818,"Again and again, the information provided in the hearing completely contradicted the rosy statements that have been coming from Donald Trump and other White House officials and warned of a dire situation ahead.",vaccine
819,"Then, at the behest of Republicans, 40% of the Obama stimulus was foolishly wasted on business tax cuts. ",taxes
820,First lady Melania Trump led an array of Americans making the case at the Republican National Convention on Tuesday for re-electing President Donald Trump over Democrat Joe Biden in November.,black lives matter
821,"Unbelievably, with all they had seen their child suffer, his parents not only refused the doctor’s suggestion that he receive another DTaP vaccination they also declined all the other scheduled vaccinations the boy had missed.",vaccines
822,"The irony of these radicalized, educated women announcing their privilege and “white guilt” as if it’s something to brag about is that doing so loudly and violently as they have in recent weeks is perhaps the highest form of white privilege.",marriage equality
823,"The pandemic is clearly the precipitating cause of today’s crisis, but there’s an underlying disease that has been with us for a long time: neoliberal economics.",vaccine
824,The transgender ideology says people have the government-enforced right to be treated as male or female according to their sense of “gender identity”.,marriage equality
825,CPA Chairman Dan DiMicco said the award is further validation from mainstream economists that permanent tariffs on Chinese imports are key to driving U.S. job growth.,international politics and world news
826,"Gervais, the no-holds-barred British comedian, returns for a fifth time and is already promising to let the barbs fly.",#metoo
827,Social-justice started to creep into the armed forces during the Obama years.,islam
828,"Sen. Bernie Sanders’ (I-VT) immigration plan, which opens the border to all foreign nationals, was drafted by a handful of illegal alien staffers.",immigration
829,"Floyd’s death has added to the disquiet among Black residents in Tulsa, which saw its own demonstrations in 2017 after a white police officer was acquitted of manslaughter for shooting a Black man during a routine traffic stop.",black lives matter
830,"Rowling has been branded a hater, even a “terrorist” who “wants trans kids to die” because she disagrees with the far left’s transgender agenda.",marriage equality
831,"Because he just can't help himself, on the Sunday before the election Donald Trump squeezed in one more act of sabotage against Obamacare, one that will create major headaches for the people of Georgia. ",universal health care
832,"In one Senate committee, a bipartisan effort was under way on Tuesday to repair Obamacare without repealing it, led by the Republican health committee chairman, Lamar Alexander, and the panel’s top Democrat, Patty Murray.",universal health care
833,"Protecting pregnant women, new mothers and children is about more than scoring political points with anti-choice legislation.",abortion
834,"But one glaring absentee was Trump, who not only declined an invitation but failed to send any American representative at all.",vaccines
835,Wikipedia’s coverage of other contentious political topics such as abortion were also criticized with Sanger singling out Wikipedia claiming abortion is “one of the safest procedures in medicine.”,marriage equality
836,"Workplace bias against gay and transgender employees has remained legal in much of the country, with 28 U.S. states lacking comprehensive measures against employment discrimination.",marriage equality
837,"But in an age when anti-vaccine conspiracy theories travel far and wide online and many parents are afraid of taking their pediatrician’s advice, Kentucky’s loose vaccination laws directly incentivize parents to follow Bevin’s lead.",vaccines
838,"It would indeed be out of character for the Trump administration to take any firm stand against criminalizing homosexuality, since Trump — despite his campaign promises that he would live and let live — has been one of the most LGBTQ-hostile presidents in modern politics.",gender
839,"Students will also be required to sign a pact promising to adhere to health protocols that include viral testing every three days, video training, daily attestations of symptoms, the use of face coverings, limits on gathering sizes and participation in a contact tracing program.",marriage equality
840,George Soros is a billionaire philanthropist and founder of Open Society Foundations.,blm
841,"[Black Lives Matter] is essentially a non-falsifiable religious cult that sets itself specifically against Christianity, just like the French Revolution did.",marriage equality
842,"Today, the same propaganda is created quickly in the form of digital memes and other media that can be shared widely across the internet, she said.",white nationalism
843,Nations including the Netherlands and France are seeking to convince fellow European countries to end tax exemptions on jet fuel and plane tickets.,taxes
844,Many forget the BLM platform is antisemitic.,islam
845,Trump attacking wind power is nothing new.,environment
846,"The tragedy of America’s 18 years in Afghanistan has been a stubborn refusal to admit the Afghan government is incapable of standing on its own, no matter how much money is poured into it, how much training its troops are given, or how many of its battles American soldiers fight.",international politics and world news
847,The law is one of the most restrictive in the United States and activists say it effectively forbids most abortions since many women do not know they are pregnant yet at eight weeks.,abortion
848,"The remarks, by the BBC’s head of drama Piers Wenger, will confirm what many viewers have long suspected: that the BBC isn’t interested in making quality programming any more – only in enforcing the politically correct obsessions (equality, diversity, etc) of the narrow, metropolitan liberal elite.",marriage equality
849,"President Donald Trump proposed eliminating federal payroll taxes altogether for the rest of the year, according to a report from CNBC Tuesday.",taxes
850,Trump's nomination of Amy Coney Barrett: Another step toward Christian fascism,islam
851,The San Francisco 49ers will fly a “Black Lives Matter” flag at Levi’s Stadium as the franchise continues its support of the fight against racial inequality.,marriage equality
852,"Lawyers for Bill Cosby on Thursday asked the Supreme Court of Pennsylvania to hear his appeal of his 2018 sexual assault conviction, a month after a lower court rejected their argument that the disgraced comedian did not get a fair trial.",#metoo
853,Paul Krugman blast GOP's claim they have a superior alternative to Obamacare,universal health care
854,"There were many reasons that Trump defeated Clinton in 2016, and sexism was surely among them. ",gender
855,"Instead, they want to force women and their doctors to subject dying newborns to further horrific medical intervention, to needles and lights and loud voices and scalpels and machines that will only prolong the inevitable, only prolong their pain.",abortion
856,"As the world’s scientists and pharmaceutical companies seek a cure for the coronavirus, other anti-vaxxers are gearing up for a fight against any potential new vaccine.",vaccines
857,"Investigators also found evidence to suggest that Koinis did not vaccinate children at parents' requests, the sheriff's office said in a statement.",vaccines
858,"I have never seen a witness stonewall like this before,"" he said. """,elections 2020
859,Never mind the fact that some of Trump’s strongest supporters have had no problem whatsoever in criticizing him for substantive reasons — as in the backlash against his criticism of Attorney General Jeff Sessions. NeverTrumpers still believe themselves to be the unique guardians of conservative orthodoxy and honest punditry.,trump presidency
860,"By associating cancel culture with mob behavior, or dictatorial attempts at thought control, critics of cancel culture use lofty ideals like “freedom of speech” to conceal and distract from the promotion of hatred—that historically has resulted in actual mob violence like lynchings.",white nationalism
861,"One in five children are having nightmares about climate change, according to a British survey on Tuesday, as students globally stage protests over a lack of action to curb global warming.",blm
862,"Navalny was poisoned with a military-grade nerve agent, according to German, French and Swedish laboratories.",vaccine
863,"Tucker Carlson has been attempting to do the dirty anti-journalistic, pro-fascist work, of carrying the hoax water of Hunter Biden-gate for Trump.",islam
864,"President Trump said during the February State of the Union that, “The American patient should never be blindsided by medical bills.”",universal health care
865,"In the weeks leading up to the District of Columbia’s primary election, a powerful interest group repeatedly hammered council candidate Janeese Lewis George with an attack that in the past has proved devastating: She was soft on crime and unsupportive of the D.C. police force.",elections 2020
866,"he conservative Club for Growth Action group launched NeverTrumperChrisJacobs.com and launched an ad, claiming that Jacobs campaigned with Never Trump Republican Bill Weld as well as refusing to back President Donald Trump in 2016. ",taxes
867,Gun-control activists have reported a growing number of online death threats as lawmakers have passed gun control legislation ahead of the rally.,gun control
868,"When carrying a firearm, you have the ultimate power of force in your control.",gun control
869,"Remember how incensed people got when Trump floated his (admittedly, impractical) ideological test for immigrants.",white nationalism
