,text,topic
0,"NYPD Commissioner Dermot Shea on Monday expressed support for diverting funds away from the police department and to other areas, like youth programs.",marriage equality
1,"School systems across the country are adopting BLM curriculum at at alarming rate, indoctrinating our children to achieve Marxist objectives.",islam
2,"And then along came President Barry Obama, who spent trillions of dollars on — what the hell did he spend all that money on?",marriage equality
3,"The curfews, which have never before occurred on an Election Day in recent times, were a response to looting that occurred after generally peaceful protests against police violence and racism. However, the curfews also come in a climate where the Republican Party, led by President Trump, has been repeatedly making false claims that voting by mail is rife with fraud",elections 2020
4,"Rather than help be a part of the solution, Trump is intentionally exacerbating the tensions–not only because he himself is a racist whose politics of authoritarian white grievance align with the same forces driving police violence itself, but because he is desperate and in grave political peril.",elections 2020
5,The Times reported that Bill Gates had met in with Epstein multiple times ,#metoo
6,"The success of the Trump administration’s Operation Warp Speed stands as one of the greatest achievements of the Trump presidency, or any presidency.",vaccine
7,"The Trump administration is proposing tariffs on up to $2.4 billion worth of French imports — including Roquefort cheese, handbags, lipstick and sparkling wine — in retaliation for France’s tax on American tech giants like Google, Amazon and Facebook.",international politics and world news
8,"Rep. Al Green (D-TX) at a hearing on Wednesday perpetuated the hoax that President Trump called white nationalists at a rally in Charlottesville, Virginia in 2017 “very fine people.”",white nationalism
9,"The British government will attempt to mitigate the economic, social, and business impacts of the coronavirus outbreak with a combination of tax cuts and new spending, the chancellor announced Wednesday, the first of the new Boris Johnson government.",taxes
10,"They repeat this mantra even though it flatly contradicts another of their favorite talking points — namely, that the Border Patrol has experienced record numbers of encounters with would-be crossers.”",immigration
11,"President Donald Trump announced Friday that Sudan has agreed to begin normalizing relations with Israel, just days after his administration said it would take the North African country off the U.S. list of state sponsors of terrorism.",islam
12,"But if there is one thing we have learned about Trump in the last four years, it's that he's a human earthworm: Every time he gets cut in half, he grows another tail using lies, cheating, and thievery.",vaccine
13,"China’s Communist party government demonstrated its sensitivity about Covid’s origin, with state-run media outlet the Global Times issuing a warning to Elon Musk not to risk his relationship with China, after he sent tweets discussing the Department of Energy report on the lab leak theory.",coronavirus
14,"As Congress begins debating the Equality Act, the Heritage Foundation warns that if the bill becomes law it will prove the death knell for women’s sports.",sport
15,Leaders from the United Methodist Church reportedly announced a tentative plan Friday to split the church over differences on same-sex marriage and the inclusion of gay clergy.,marriage equality
16,Biden rejects Trump claim that COVID-19 vaccine is imminent,vaccine
17,President Donald Trump on Monday held a White House meeting to discuss the possible development of a COVID-19 vaccine with representatives of the nation’s top pharmaceutical and biotech companies.,vaccine
18,Pompeo appeared hopelessly lost when WSMV’s Nancy Amon was far better prepared for an interview than he was.,white nationalism
19,"While the workaday majority of Americans continue to be mired in our low-wage economy, the precious few at the tippy top soared out of sight in 2019.",middle class
20,Several medical and advocacy groups have insisted abortion services should be considered as essential health care during the Chinese coronavirus pandemic and not subject to delays or a reduction of availability that will affect other health services.,abortion
21,"Former Secretary of the Navy Richard V. Spencer on Friday endorsed Democratic presidential candidate Michael Bloomberg, making him the first high-level former Trump administration official to back a Democratic hopeful in the 2020 election.",trump presidency
22,"First Joe Biden said he still supported the Hyde Amendment, which prohibits taxpayer funding of most abortions, , then changed his position one day later, after tremendous political pressure from farther-left Democrats.",abortion
23,Floyd's funeral service took place at the Fountain of Praise Church in Houston.,marriage equality
24,"More recently, a case this year was won against the Syrian regime of Bashar al-Assad, regarding the president’s direct involvement in the targeted killing of American journalist Marie Colvin amid the vicious civil war and dissident crackdown in 2012.",international politics and world news
25,Hollywood celebrities began tweeting that they hope the incident will finally motivate Congress to pass more intensive gun control measures.,gun control
26,"There’s good evidence for its effectiveness; studies have shown, for example, that taking a 50-minute walk in the woods improves the cognitive powers of people with depression and reduces blood pressure in stressed-out students.",environment
27,Germany tries to stop Trump from luring away firm working on coronavirus vaccine.,coronavirus
28,"As much as our society tries, we cannot cleanly separate the physical from the metaphysical during reproduction.",abortion
29,On Sunday nights and early Monday mornings the online LGBTQ chatter is focused on whether the Supreme Court will issue—at 10 a.m. on that Monday morning—its long-awaited decision about whether it is OK to fire someone because they are LGBTQ.,marriage equality
30,"Although he didn’t seem to direct his comments at anyone in particular, many celebrities that consider themselves climate change activists have not adjusted their lifestyles of taking private jets to their engagements around the globe, for example, Leonardo DiCaprio, Katy Perry and Orlando Bloom all took heat in 2019 when they were among the A-listers to attend Google’s climate change conference by way of private jets and mega yachts.",environment
31,The El Paso attack has also put new pressure on a man some white nationalists praise as helping advance their movement: Donald Trump.,white nationalism
32,"This kind of over-the-top misogyny is, not surprisingly, being accompanied by an absolute barrage of violent fantasies from the gun lovers who plan to descend on Richmond on Monday.",gun control
33,"The demonstrators stopped in the center of town and took a knee to honor George Floyd, who was killed in the custody of police in Minneapolis, Minnesota, on Memorial Day.",black lives matter
34,"Those survivors had to expend more effort to concentrate on simple tasks, a symptom consistent with PTSD.",environment
35,"Next came the sob stories. Those student loans are suffocating a generation, the candidates suggested. After all, “40 million of us who can’t start a family,” the diaper-changing daddy Swalwell contradictorily proclaimed, adding that they “Can’t take a good idea and start a business and can’t buy our first home.”",student debt
36,"Protesters in New Zealand’s Auckland city sat on the road after their peaceful march as they raised clenched fists in a sign of unity, solidarity and Black Power.",black lives matter
37,"Senior White House officials are discussing the possibility of a temporary payroll tax cut in an effort to boost the economy in the face of a potential slowdown, the Washington Post reported on Monday, citing three people familiar with the discussions.",taxes
38,"How do we deal with the false perception that liberals are more inclined to trust science than conservatives? Or, how do we approach the media’s fondness for focusing on the unscientific views of some conservatives but ignoring the irrational—and oftentimes, more consequential—beliefs of their fellow liberals?",vaccines
39,"The Republican Party, unsurprisingly, has taken the position that President Trump should be defended.",islam
40,It matters that figures like Marsha Blackburn are trying to smear a decorated American war hero. It also matters why she's engaged in such a toxic scheme.,white nationalism
41,"In Spain, hundreds of thousands of women, wearing purple and raising their fists, took to the streets of cities around the country calling for greater gender equality.",gender
42,"But she couldn’t shake criticism that she was an outsider compared to Leger Fernandez, who has served as counsel to several Native American tribes in the northern New Mexico district and had the backing of the Congressional Hispanic Caucus.",elections 2020
43,"For one thing, his plan would slash subsidized student loan repayment plans, and let the government crack down on missed payments. To left-wing politicians who think the state should hand out more subsidies, this might as well have been Armageddon.",student debt
44,"""Orange Is the New Black"" star Yael Stone is renouncing her U.S. green card to return to her native Australia in order to fight climate change.",environment
45,Disney’s executives stopped advertising on Tucker Carlson’s television show as he repeatedly urged President Donald Trump to shut down their pipeline of H-1B visa workers into the white collar jobs that would otherwise go to Americans.,marriage equality
46,"In an apparent attempt to blame sexism for the blowback the Rashida Tlaib received for her ""Impeach the Motherf*cker"" remark, Pelosi wondered aloud what the response would have been if a man made the same comment. ",gender
47,Man asking white woman to kneel and apologize is not a representative of Black Lives Matter,blm
48,"A vaccine is not a requirement for holding next year's postponed Olympics and Paralympics, the CEO of the Tokyo Games said Friday.",vaccine
49,The moment was yet another headache for Biden as he struggles to appeal to gun owners. ,gun control
50,Protesters also burned smaller American flags on the embers of the larger one a day after demonstrators defaced and attempted to pull down an Andrew Jackson statue in Lafayette Park.,marriage equality
51,"The dynamic exposes two underappreciated realities of Trump’s Iran obsession: Any U.S. war on Iran will ignite war in Iraq, and U.S. credibility is visibly faltering across the region. ",international politics and world news
52,"Meanwhile, Thunberg first made headlines when her Fridays for Future campaign went global in the last few months. At a U.N. climate conference in September, she repeatedly scolded world leaders, asking, “How dare you?”",environment
53,"Beto O'Rourke defends Ilhan Omar, assails Trump as 'racist' as his celebrity status wanes",islam
54,"It’s only a matter of time, the argument goes, before the Roe v. Wade precedent is struck down at the hands of five conservative justices, two of whom are on the high court thanks to Trump.",abortion
55,"A report by the United Nations (UN) falsely blamed President Trump for the detention of 100,000 migrant children who, in fact, were held in federal immigration custody in 2015 by President Obama.",immigration
56,Hate is the GOP brand under Trump and sadly it’s working to attract like-minded people to its ranks.,islam
57,"In a series of early morning tweets on July 26, 2017, that reportedly took the Department of Defense by surprise, President Donald Trump announced that he was reinstating the repealed ban on transgender military service.",gender
58,"The Turkmen government also published photos of contact sporting events such as wrestling and martial arts, which most of the world has canceled to prevent the spread of the deadly pathogen originating in central Wuhan, China.",sport
59,"Some party leaders, including House Speaker Nancy Pelosi, have warned that the focus on Medicare for All could cost Democrats with swing voters next year.",universal health care
60,"Visiting West Indies skipper Jason Holder has said it would be a team decision for them whether to protest the death of George Floyd, an unarmed black man who died in Minneapolis last month after a white police officer knelt on his neck for almost nine minutes.",black lives matter
61,"Prosecutors have said the gunman targeted a Tops Friendly Markets supermarket in a Black neighborhood of Buffalo, about 200 miles (320 km) from his home in Conklin, New York, intending to kill as many Black people as he could with an assault weapon.",gun control
62,"At what point did we decide George Washington and Abraham Lincoln were moral monsters, or that all police are racist thugs?",marriage equality
63,Activists’ frustration has only compounded since Chief Executive Mark Zuckerberg’s decision last month to allow two posts by President Trump that many Facebook employees and outside advocates believe broke the company’s content rules.,marriage equality
64,"Republicans should stop fighting amnesty, President Obama said on Thursday, because one day a Hispanic will become president.",student debt
65,"Conservative Christians exploded on social media, citing the controversy as further proof that their faith is under attack by intolerant liberals and coastal elites who care little about human life.",islam
66,"Many monuments of historical figures have been boarded up as anti-racism protesters taking to the streets following the death of African-American George Floyd, have put statues at the forefront of their challenge to Britain’s imperialist past.",black lives matter
67,"The odds of giving birth prematurely was also higher in pregnant and recently pregnant women with COVID-19, compared to those without the disease.",vaccine
68,"It would take a year to 18 months to fully validate any potential vaccine, the AP added, citing public health officials.",vaccine
69,"The Trump administration may no longer enforce a rule requiring individual Americans to carry health insurance or pay a penalty if they do not, a senior White House official said on Sunday",universal health care
70,"It’s just that, instead of having the chance to grow up in a loving family, the child’s lifeless body is discarded into a bucket of medical waste.",abortion
71,"Instagram will start blocking any hashtags spreading misinformation about vaccines, becoming the latest internet platform to crack down on bad health information.",vaccines
72,Edwards’ allies are pushing a narrative that supporting Rispone is akin to being a racist like infamous white supremacist David Duke.,white nationalism
73,Privacy advocates on Monday raised concerns over reports that Indian security forces used facial recognition technology to identify dissidents at a political rally in December and warned that if left unchecked the government would continue to suppress dissent.,islam
74,"Equally important, he notes, is that it is difficult for incumbents to distance themselves from Trump over fears he will turn his base against them — meaning they are in a trap of their own making.",elections 2020
75,"Veteran conservative columnist and former Nancy Reagan speechwriter Mona Charen, in a scathing article published by The Bulwark on December 27, lambasts Abbott for his “cruelty.”",immigration
76,"Since Ocasio-Cortez first mentioned the 70 percent tax rate on CNN, a number of mansplaining journalists have written harrumphing pieces explaining that the ""real"" problem is tax loopholes or capital-gains tax rates set too low.",taxes
77,"The current travel ban, which the administration re-worked during a series of court challenges, indefinitely suspends the issuance of immigrant and non-immigrant visas to applicants from Libya, Iran, Somalia, Syria, Yemen, North Korea and Venezuela.",islam
78,"The spectacular rise of human civilization that took place during the last 10,000 years now appears to be coming to an end with the refusal of our species to significantly curb the carbon emissions and pollutants that might cause human extinction.",environment
79,"The head of the Communist Party’s special panel to address the coronavirus crisis, Zhong Nanshan, was quoted in state propaganda outlet Xinhua saying that the government believed the outbreak would peak within 7-10 days, then start subsiding.",vaccine
80,"A Supreme Court filing lays bare the deep chasm between prominent Republicans who believe in the rule of law and wannabe president for life Donald Trump, whose says he enjoys absolute immunity from any inquiry into his conduct.",taxes
81,And if Bezos imagines that this act of blatant greenwashing will do anything either to save the planet or make the world a better place than he is living in cloud cuckoo land.,taxes
82,Biden said he would seek Muslims to serve in his administration.,islam
83,"The First Amendment is also not a priority for the right, for all its whimpering about ""freedom of speech.""",marriage equality
84,"New York Attorney General Letitia James said in her complaint, filed in Manhattan federal court earlier this month, that “PHEAA’s abuses have not only denied these dedicated public servants the benefits they have earned, but have undermined the goals of the loan forgiveness program.”",student debt
85,They’d be standing aside and waving them on in.,immigration
86,"Even the European Union (with the Maastricht Treaty in 1993) has adopted the radical economic and political ideologies of Thatcherism and Reaganism—neoliberalism—that benefitted wealthy elites while forcing austerity on its poorer member nations, inflicting massive pain and inciting right-wing movements in Greece, Spain and Italy, among others.",middle class
87,This would make for a much better “feminist” movie than that stupid flop about Ruth Bader Ginsberg.,#metoo
88,Health and Human Services (HHS) Secretary Alex Azar announced during a White House press conference on Friday that the Trump administration will end surprise billing for Americans without health insurance.,universal health care
89,"Trump regularly uses Twitter to attack his political enemies, including the late Sen. John McCain, deride media outlets like CNN and he has retweeted unverified anti-Muslim videos.",islam
90,The Affordable Care Act’s (ACA) “risk adjustment” program is intended to incentivize health insurers to cover individuals with pre-existing and chronic conditions by collecting money from insurers with relatively healthy enrollees to offset the costs of other insurers with sicker ones.,universal health care
91,"Once powerful Hollywood producer Harvey Weinstein was charged in Los Angeles on Monday on sex crime charges just hours after he appeared in a New York court for the start of his rape trial, which has become a focal point for the #MeToo movement.",#metoo
92,The player vote ending Thursday at midnight—a simple majority vote will determine the outcome of the NFL CBA—is a monumental referendum for the next decade of the NFL.,sport
93,"Over four years later, she and her daughter are coping with the lingering trauma from the wildfire’s apocalyptic smog, heat, and destruction.",environment
94,"For our friends on the Left, Trump’s refusal to wear a mask is irresponsible toxic masculinity that is sending the wrong message and getting people killed, even though Dr. Deborah Brix has explained it’s not much of a risk. Biden, meanwhile, to their minds is leading by example by wearing his mask even when there is no good reason he should.",elections 2020
95,"But rather than appreciate the fact that Asian-American women are considered highly attractive, Lim sees only a sneaking racial bias, a reflection of our upside-down cultural world where victimhood and oppression carry more social currency than even beauty and success.",white nationalism
96,"The Republican-led Legislature and GOP Gov. Bill Lee have dismissed the idea of offering absentee ballots to all voters, with lawmakers voting against Democratic expansion proposals more than once this week as they meet during pandemic times.",elections 2020
97,"He has been critical of illegal aliens, but not immigrants in general. Weaver nonetheless implies Trump is somehow responsible.",white nationalism
98,"People were tear-gassed, manhandled, shoved, battered with clubs and slammed with shields on Monday to clear the way for Trump to cross the street from the White House for a photo op at St. John’s Episcopal Church. The onslaught against the protesters began 25 minutes before a 7 p.m. curfew. ",trump presidency
99,"George Floyd would be pleased with the strong U.S. jobs data released Friday, President Donald Trump said, invoking the memory of the black man who died in police custody and looking past African American unemployment at the highest in more than a decade.",blm
100,"Anti-vaxxers were a source of misinformation long before the coronavirus pandemic, but the medical emergency appears to be bringing more of them out of the woodwork.",vaccine
101,"The president has called for a tough response to the protests in order to ""dominate the streets"" and has threatened to call in active-duty troops to quell unrest in cities where local authorities were unable to do so. ",trump presidency
102,Here’s why the fear of medical bankruptcy could make the spread of coronavirus even worse in the US,universal health care
103,"U.S. Senator Amy Klobuchar on Monday will become the third 2020 Democratic presidential candidate in as many days to leave the race, her campaign confirmed, and she and fellow moderate Pete Buttigieg plan to endorse former Vice President Joe Biden.",islam
104,"However, while some are celebrating the changes as a victory, others have expressed doubt as to how meaningful the changes really are.",gender
105,"Trump may not be much of a stable genius, but he doesn't need to be the brightest bulb on the KKK Christmas tree to be a racist troll.",black lives matter
106,"Matters worsened for him when COVID-19 hit the United States and exposed him not just as a divisive buffoon, but a cynically incompetent one. The Administration delayed its response, worried that any action they took would hurt the stock market and erode Trump’s last remaining electoral strength.",elections 2020
107,A Trump-loving white security guard with a racist past shot and killed an unarmed Black man during an unprovoked hotel parking lot attack.,black lives matter
108,A report in The New York Times claims that the UFC star Conor McGregor sexually assaulted a woman in Ireland.,sport
109,"According to a Washington Post analysis updated on Monday, half of people killed by police are white, but Black Americans are shot at a disproportionate rate. ",black lives matter
110,"Several dozen demonstrators, many armed and carrying Confederate battle flags, staged a rally in the Atlanta suburb of Stone Mountain next to a park famed for its giant monument to leaders of the breakaway slave-holding states.",black lives matter
111,"The same goes for Govs. Gavin Newsom, Andrew Cuomo, Jay Inslee, and every other Wuhan virus Karen issuing diktats from on high.",vaccine
112,"The Republican president proceeded to pitch an aggressively anti-immigrant message ahead of Election Day 2018, when voters handed Democrats control of the House.",immigration
113,"Nearly a third of students polled planned to use some of their student loan money to pay for their spring break trips, while 23 percent said they had used loans to purchase alcohol, and 6 percent said they used the money for drugs.",student debt
114,It will be a media and corporate blitzkrieg. The same machinery currently pushing Black Lives Matter ideology will be easily repurposed for the gun control blitz. ,gun control
115,"As a result, income inequality now rivals that of the robber baron days of the early 1900s, when labor unions were virtually outlawed while corporate monopolies thrived.",middle class
116,"Then the tenor changed. What started as irony turned into an actual belief that white people, specifically white men, are more dangerous and immoral than any other people.",white nationalism
117,"Gendron's defense attorney, Brian Parker, told a news conference that his client was remorseful.",gun control
118,"More subtly, however, Pelosi is also using her gender to put Trump — who is visibly unnerved by having any woman around that isn’t clearly there to serve him, sexually or otherwise — on his heels. ",gender
119,"Alex Berenson, a former reporter at the New York Times who has written extensively debunking fearmongering claims related to the lockdowns wrote on Twitter Thursday that the tech giant to benefit the most from pandemic stay-home orders is refused to sell his latest book.",coronavirus
120,"For some years now, conservative and libertarian education policy experts have warned against voucher systems in favor, instead, of tax-credit scholarships and education savings accounts, which are less likely to drag the regulations and mandates of government schools into the private arena.",student debt
121,Elizabeth Banks pointed out that knowing what other women and men are making in Hollywood is essential to making pay equitable across gender lines. ,gender
122,"Last month, the prestigious Scientific American magazine announced that for the first time in its 175-year history, it would endorse Joe Biden, the Democrat nominee, for the 2020 U.S. presidential election.",vaccine
