,text,topic
2299,"Trump has also repeatedly threatened to cut off billions of dollars of payments to insurers that they are guaranteed under the law, creating uncertainty and chaos in the individual insurance market.",universal health care
2300,"Charen adds, “The (U.S. Customs and Border Protection) reports that agents had 2.2 million encounters with illegal border crossers in fiscal year 2022 — a new record.",immigration
2301,"University of Texas at Austin student Sanika Nayak argued that men make gym facilities uncomfortable for women and proposed that the University of Texas should divide the gym into protected sections, so that female students can feel more comfortable when they are exercising.",gender
2302,"In March, President Trump signed an executive order closing the southern border to stop the spread of the virus from undocumented immigrants who are possibly infected.",immigration
2303,"Sure, the coronavirus pandemic is racing through the American population like an out-of-control locomotive.",vaccine
2304,"State-backed hackers from China have targeted staffers working on the U.S. presidential campaign of Democrat Joe Biden, a senior Google security official said on Thursday. The same official said Iranian hackers had recently targeted email accounts belonging to Republican President Donald Trump’s campaign staff.",elections 2020
2305,Since the Democrat Congress and the Obama administration orchestrated the government takeover of student loans in 2010 the total amount of student loan debt has exploded.,student debt
2306,"The U.S.-Saudi war in Yemen, the bloody war that Trump continued, over the bipartisan congressional objections, has generated the world’s worst humanitarian crisis, and it is farther than ever from success.",international politics and world news
2307,Trans Women Are Women': Daniel Radcliffe Hits J.K. Rowling for Opposing Woke Gender Theory,marriage equality
2308,"In the past few weeks, advertisements for hundreds of brands -- including Adidas, Starbucks, Patagonia, and Pepsi – have been disappearing from Facebook as the Stop Hate for Profit boycott campaign gears up.",marriage equality
2309,President Joe Biden made a bizarre race-related comment on Monday at a Black History Month event hosted at the White House.,blm
2310,Fauci said he was positive a vaccine was on the way and hopeful it would be here shortly.,vaccine
2311,Bloomberg claims he has been against redlining.,universal health care
2312,"Biden, the former vice president making his third run for the White House, said Trump’s tax cuts for the wealthy and other economic policies were increasing economic inequality in the United States.",taxes
2313,"Facebook posts, shared thousands of times, claim Melinda Gates has said black people must be vaccinated first for COVID-19, after health care workers.",vaccine
2314,The House Democrats’ coronavirus recovery bill allows several hundred thousand foreign workers to get college jobs or blue-collar jobs while millions of Americans lose their careers.,coronavirus
2315,"The protest was part of ongoing nationwide demonstrations against the killing of George Floyd by police in Minneapolis, Minnesota, last week.",black lives matter
2316,"The biggest swimming pool in Russia’s Muslim-majority North Caucasus region has banned women, prompting anger from rights activists and others who have accused the sports complex of discrimination.",gender
2317,"Under President Reagan, church and state became inextricably intertwined and have remained so, with the Trump administration’s backing of “religious freedom” and “religious liberty” as battering rams against LGBTQ rights and reproductive choice.",marriage equality
2318,"When a figurehead like Trump repeats the myth that vaccines cause autism, as he did during the presidential debates, many parents may choose not to vaccinate, putting children at unnecessary risk.",vaccines
2319,"Over the past few decades, RFK Jr.’s famous name has helped him get in the door to talk to important people, and it probably isn’t long before the person who is all jacked up to meet a Kennedy realizes the guy is totally cray-cray.",vaccines
2320,"After walking past the mural, Kabul resident Dost Muhammad Momand said it had been painful to watch the video of Floyd’s death and that he identified with the constant fear of violence.",black lives matter
2321,"Rep. Alexandria Ocasio-Cortez (D-NY) slammed billionaire Jeff Bezos, the richest man in the world and owner of the Washington Post, for paying his employees what she called “starvation wages.”",middle class
2322,"He warned protestors not to use Floyd’s death to “tear up the Alamo or tear up a restaurant,” or use it as an excuse to burn or steal.",black lives matter
2323,A pro-Trump political ad quotes Joe Biden directly and the lying liars at the lying PolitiFact still rate it “mostly false.”,taxes
2324,People who objected to his dirty war in eastern Anatolia against dissident Kurdish villagers were likewise punished.,islam
2325,"Ivanka Trump, President Trump’s daughter and a White House senior adviser, lauded her father’s economy and said the majority of Americans ideologically believe differently than Rep. Alexandria Ocasio-Cortez, D-N.Y., in an interview with Fox News host Steve Hilton.",middle class
2326,"When it comes to the Green New Deal blueprint to address the climate crisis, Republicans generally like to pretend it calls for the elimination of hamburgers.",environment
2327,Crisis in chief: The president is spreading disinformation about the coronavirus — and there's no way to stop him,vaccine
2328,The simmering anger and demands for justice ignited by these deaths and others translated into huge voter turnout by Black Americans in November's presidential election.,black lives matter
2329,"It's also a function of the moral hazard that allows a plutocrat like Donald Trump to gain control over a so-called democracy with the goal of funneling resources (through tax policies, government subsidies and other laws) to themselves and other members of his class, while denying resources and opportunities to the vast majority of Americans.",taxes
2330,The justices threw out a challenge from gun rights groups.,gun control
2331,"If we want to explain what has happened to the Republican Party, which all must try to do in this hour of crisis when democracy itself is on the line owing to Republican perfidy, it is essential for us to view events not from the perspective of the rational actor but from that of the party politician.",islam
2332,Time Magazine Naming Joe Biden ‘Person Of The Year’ Makes Total Sense For Today’s Boot-licking Media,vaccine
2333,"Rose, who ran ads bashing de Blasio in his freshman bid for Congress two years ago, also took aim at the mayor's overall COVID-19 response from testing to school strategy.",vaccine
2334,"The Trump administration anticipates launching a far-reaching promotions campaign by November to encourage Americans to get vaccinated against the coronavirus, contingent on evidence that a successful vaccine will be available roughly by year end, a senior administration official said.",vaccine
2335,"Transgender controversy also erupted ahead of International Women’s Day in Leicester, after a students’ union at Leicester University voted to rebrand the day as International Womxn’s Day, in order to be more inclusive of transgender women.",gender
2336,"Democrat megadonor and healthcare executive Judy Faulkner has tried to block a Trump healthcare rule that would cut healthcare costs, grant patients more control over their healthcare data, and preserve her company’s dominant status in the electronic healthcare record market.",universal health care
2337,United Airlines said Tuesday it would suspend 24 flights between the U.S. and China the first week of February amid growing concern about the spread of the coronavirus that originated in the Asian nation.,coronavirus
2338,"By the time Officer Joseph Ferrigno shot a Black man from behind, court records show, the Rochester cop had drawn at least 23 misconduct complaints in nearly nine years on the force",gun control
2339,Chaotic George Floyd protests have left the Big Apple splattered with graffiti.,black lives matter
2340,The photograph of Katie Bouman sitting in front of her computer with the first black hole image instantly made her the face of the project — which is why an informal coterie of sexist trolls kicked off a sexist investigation to invalidate her contributions.,gender
2341,"During the fifth debate in the Democratic race to pick a challenger to Trump in the November 2020 election, the 10 candidates aired differences on healthcare and taxing the wealthy, but kept the exchanges largely polite and instead heaped heavy criticism on Trump.",taxes
2342,"Secondly, the Democrat field is so awful, there aren’t any acceptable alternatives.",taxes
2343,Here are three obvious but important ways the media demonstrated a disgusting partisan slant instead of good journalism.,vaccines
2344,"Christian persecution around the globe reached an unprecedented level at the end of 2019, with over 260 million Christians facing “high levels of persecution,” Open Doors revealed Wednesday.",islam
2345,"Donald Trump claimed he has seen evidence the new coronavirus originated in a Chinese lab, as he threatened tariffs on Beijing over its role in the global pandemic.",international politics and world news
2346,It was a moment where Keon stood at the apex of his white male power as the chancellor of a major university speaking at commencement.,white nationalism
2347,"Missouri State Auditor Nicole Galloway, who is running for governor, is accused of potentially misusing Missourians’ taxpayer dollars to her advance her political career.",gun control
2348,"The former vice president, who spent a majority of his nearly 40-year political career in the United States Senate, made the remarks on Monday in an interview with several prominent media outlets.",gun control
2349,"Velasquez, 27, is among the nearly 700,000 undocumented young people who were brought to the USA as children and rely on the Deferred Action for Childhood Arrivals program, or DACA, that President Donald Trump wants to terminate.",immigration
2350,"A transgender woman, Suki was beaten up by a group of assailants last week with sticks and plastic pipes in Seremban, a town south of the Malaysian capital Kuala Lumpur.",blm
2351,Cable news is poison.,marriage equality
2352,"For decades, Democratic administrations have been cleaning up economic messes left to them by Republican administrations.",taxes
2353,"“This new wording, I would worry, does leave it up to teachers a little too much,” McGuirk wrote in an article examining the government U-turn. “",gender
2354,The “OK” hand gesture is among the 36 new entries added Thursday to a database of hate symbols used by white supremacists and other far-right extremists.,white nationalism
2355,may,elections 2020
2356,"Putin remains popular with many Russians, although his trust ratings have taken a beating after the introduction of a very unpopular pension reform in 2018.",international politics and world news
2357,"Meanwhile, the California Democrat claimed the Heroes Act is “disciplined, focused, necessary.”",taxes
2358,"Wray’s public endorsement of the lab leak theory runs counter to the conclusions of several prominent scientific studies, as well as the assessments of some other US intelligence agencies.",coronavirus
2359,"But, yeah, good work each and every one of you reporters who made this fake story something to waste time on this week. You’re all hacks.",vaccines
2360,The Trump Administration hasn’t built a single foot of border fencing after thirty months of riling up its supporters with claims that the wall was vital to national security.,immigration
2361,"France has in recent years been forced to take a hard look at its core values, perceived by many to be threatened by Islam following a string of jihadist attacks that have killed over 240 people since 2015.",islam
2362,Trump’s tax cut proposal came just days after his ridiculous assertions that when America had only 15 confirmed coronavirus cases the umber would quickly fall and with warmer weather the pathogen would lose its deadly power.,taxes
2363,The protestors reportedly are demanding that  Gov. Andrew Cuomo hike taxes on the state’s billionaires to make up for the revenue shortfall created by the Chinese coronavirus pandemic. ,taxes
2364,"Memories of smashed windows, stolen merchandise and stores set ablaze is fresh in the minds of business owners in major U.S. cities including New York, Los Angeles and Portland, where aggressors damaged buildings under the cover of peaceful demonstrations sparked by the May 25 police killing of George Floyd, a Black man.",black lives matter
2365,"Democrats were going soft on gun control, thereby providing an open door to secure a pro-Second Amendment agenda.",gun control
2366,"Elizabeth Warren and Bernie Sanders disagreed in a Democratic presidential debate on Tuesday over whether he once told her a woman could not win the White House in 2020, underlining an emerging rift between the progressive contenders as the first voting nears.",gender
2367,"In office, however, Trump has continued the GOP crusade against Medicaid. ",universal health care
2368,"Lisa Nandy, the Member of Parliament for Wigan and one of the three remaining candidates in the Labour leadership race, said that men who identify as women, like convicted child rapist Christopher Worton, who now identifies as Zoe Lynes, should be able to be transferred into female prisons.",gender
2369,Many critics point to the most obvious flaw in MMT: that it would simply push the federal deficit and the national debt — already skyrocketing — to further and further extremes.,taxes
2370,Nevada’s Feb. 22 nominating contest is the third one in the state-by-state process of picking a Democratic nominee to face Republican President Donald Trump in the Nov. 3 general election.,blm
2371,"Thousands of protesters stormed the security perimeter of Barclays Center in New York as protests spread across the United States over the killing of George Floyd, a Minneapolis black man who died after being pinned by the neck under a white police officer’s knee.",black lives matter
2372,"In a statement on Sunday police said 113 people had been arrested over the weekend and 23 officers were injured in the violence, none of them seriously.",black lives matter
2373,President Trump is perfecting the art of the peace deal.,islam
2374,While Democrats were diverting the attention and energy of the entire country into a pointless trial that could not possibly have ended in anything other than President Donald Trump’s acquittal...,coronavirus
2375,Trump's haphazard decision to threaten a war with Iran also puts Americans at risk of terrorist attacks and undermines previous efforts to roll back Iran's nuclear program.,marriage equality
2376,The Trump administration on Thursday proposed rolling back an Obama-era rule for workers who provide in-home care through state Medicaid programs that could eliminate their automatic union dues payments.,universal health care
2377,"Janet Yellen, the first woman to lead the Fed, said she ramped up efforts once she was appointed chair in 2014.",blm
2378,"Vice President Mike Pence — a Christian conservative with a long history of anti-science views, including both denying that condoms are safe and cigarettes are dangerous — is running the White House coronavirus task force, which is no doubt one of the big reasons the U.S. has one of the worst responses to the pandemic in the world.",vaccine
2379,The country’s racial divide remains a political vulnerability for Trump.,blm
2380,An American astronaut and a Russian cosmonaut returned safely to Earth on Thursday after a Russian booster rocket carrying them to the International Space Station failed shortly after launch.,international politics and world news
2381,The left is blacklisting us for referring to biological men as “he.”,marriage equality
2382,"Pope Francis named the first woman to hold a high-ranking post in the Secretariat of State, the male-dominated Vatican's diplomatic and administrative nerve center.",gender
2383,"Why did Democrats vote overwhelmingly against a bill that would require infants born alive after abortion to be treated as any other infant born at that gestational age? Because abortion is the right to destroy one’s own child, and if a woman chose to kill her baby, to the left it would seem a violation of her so-called right to choose for doctors to try to save that baby.",abortion
2384,"Due to the pandemic, polio and measles vaccination campaigns have been heavily impacted, with the former having been halted in 27 countries.",vaccines
2385,"The utter failure of private capitalism to prepare for the coronavirus should have surprised no one. Private capitalism, as business school graduates repeat, focuses on profit. The “profit incentive,” they learn, makes private capitalism the superior, “most efficient” economic system available.",coronavirus
2386,"Bernie Sanders’ Democratic presidential rivals warn that nominating the self-described democratic socialist will ensure President Donald Trump’s re-election, but a growing number of the party’s voters see the senator as their best chance of winning in November.",blm
2387,The Age of Conspiracy Theories in which we are now immured has produced a kind of bastard offspring: the Shared Violent Fantasy,gun control
2388,"Remarkably, the first three years of Trump’s presidency were relatively smooth sailing outside of self-inflicted crimes and mishaps. His actual approach to life was never fully tested in the Oval Office. Now, with the first real challenge of his presidency, he is utterly adrift.",coronavirus
2389,"In their place, Trump credits himself for early and stronger travel bans, even if the evidence now is about home-grown coronavirus spread.",vaccine
2390,Elba was recently the subject of considerable media attention after being one of the first celebrities to contract the Chinese coronavirus.,marriage equality
2391,"In an interview excerpt broadcast by CNN on Saturday, Harris said Trump had a track record of suppressing expert opinion about the coronavirus pandemic and that she worried that might happen again in the case of a prospective vaccine.",vaccine
2392,"Activist Dorian Wilde said anti-LGBT statements from officials cause stigma and discrimination towards the community, and transgender people in particular have to bear the brunt of the hatred due to their visibility.",blm
2393,This is far from the first time Klobuchar has dismissed Trump’s tax cuts.,middle class
2394,Trump acknowledged there might be a resurgence of the virus as states loosen the restrictions on businesses and social life aimed at curbing its spread.,vaccine
2395,"Although U.S.-based sporting goods companies now produce almost none of their own gear, increasing the cost of imports from China could still jeopardize thousands of U.S. white collar jobs in design, product development, and sales and marketing.",sport
2396,"President Donald Trump, addressing a less-than-full arena for his first political rally in months, blasted anti-racism protests and defended his handling of the coronavirus on Saturday in a bid to reinvigorate his re-election campaign.",blm
2397,LGBTQ health experts said Always's decision to remove the female signs from its products is an ostensibly small change that may have significant consequences for trans and nonbinary people.,gender
2398,"Biden’s five picks are typical of centrists who want to trim the edges of our bloated, draconian justice system without changing anything systemically.",elections 2020
2399,‘Gangster capitalist’ Trump is running a ‘mafia state’ — and things are about to get worse: Pulitzer Prize-winning journalist,black lives matter
2400,"This story starts, as many tales of Republican incompetence do, with sheer ignorance and lack of curiosity.",vaccine
2401,Jamaica has suspended the use of a badge representing one of the highest British royal honors after anti-racism protesters decried its imagery of a white angel standing on the head of Satan depicted as a chained man with dark skin.,black lives matter
2402,"We, as Muslim and Hindu women of color, have watched in horror as both the country of our ancestors, India, and the country of our birth, the United States, have devolved into nationalism and fascism.",islam
2403,"So far, there have been no arrests linked to the poisonings.",islam
2404,"Two-thirds of activists believe it’s justified to break the law to create “systemic change,” according to a new poll released Wednesday by the Altruist League.",marriage equality
2405,"That was because stingy lawmakers, mostly Republicans but some Democrats, refused to enact the full stimulus package former President Barack Obama's economic advisers sought using the same economic principles as I.",taxes
2406,Gates added that raising taxes on the wealthy would narrow the wealth gap between the richest and poorest of Americans.,middle class
2407,Court filings show the NRA is in shambles — and Wayne LaPierre hopes his lawyer can ‘keep him out of jail’,gun control
2408,"Republicans, however, still believe they can win, given the radicalism of the Democratic Party and the frailty of former Vice President Joe Biden, who was an extraordinarily weak primary candidate and who has barely left his home in Wilmington, Delaware, for months.",gun control
2409,It’s also why attempts to portray pro-lifers as racists smack of disingenuousness.,abortion
2410,"On Wednesday, democrats got a chance to grill President Donald Trump's point person on deregulation as Andrew Wheeler came to Capitol Hill for his confirmation hearing to be the next permanent administrator of the Environmental Protection Agency.",environment
2411,"While emphasizing he’s not singling out either party, Cohen warned about the danger of normalizing white supremacist ideology.",white nationalism
2412,"Again, while the challenges of adoption for children are real, those imperfections don’t justify the alternative of killing them.",abortion
2413,"President Donald Trump in an interview on Wednesday ripped former Vice President Joe Biden for failing on race relations, after 43 years in public office.",elections 2020
2414,"A shocking new study says that the ice in the Arctic Ocean will disappear by 2050, which could have ""substantial"" implications on the ecosystem and the climate in the region.",environment
2415,"Yet it far better applies to unelected career bureaucrats’ use of their power to prosecute their political enemies, which comprises the heart of the “resistance” to Republican rule that will endure so long as bureaucracy has enough power to challenged elected branches of government. This bureacracy weaponization was also a hallmark of the Obama presidency, with — ironies of ironies — perhaps the biggest evidences again coming from the Department of Justice under attorneys general Eric Holder and Loretta Lynch.",elections 2020
2416,Democrats Claim Amy Coney Barrett Confirmation Would Threaten Health Care,universal health care
2417,Former Vice President Joe Biden asserted the Medicare for All proposal championed by his progressive rival Sen. Bernie Sanders (I-VT) would require massive tax increases.,universal health care
2418,But Trump and his cabal and cult members are never to be questioned about their vile behavior.,islam
2419,"When parents borrow, the debt can weigh down families for generations but the burden falls particularly hard on low-income black families.",student debt
2420,There is no such thing as a moderate Muslim. They’re ALL the same.,islam
2421,Soccer players who defy Olympic rules by making protest gestures at the 2020 Tokyo Games will be supported by their global union.,sport
2422,"According to Planned Parenthood office in Roanoke, Virginia, the abortion giant will continue to perform abortion services during the COVID-19 pandemic, claiming abortion is an “essential” medical service.",abortion
2423,Gendron was 18 at the time of the attack.,gun control
2424,"After Donald Trump won the presidency in 2016 and the left-wing terrorists in Antifa took to the streets, everything changed again.",gun control
2425,"U.S. President Donald Trump’s businesses lost a total of more than $1 billion from 1985 to 1994, according to the New York Times, which said it obtained printouts from Trump’s official Internal Revenue Service tax transcripts.",taxes
2426,Joe Biden appeared to suffer trouble with his teleprompter on Friday and said George Floyd was to blame for his delayed jobs plan.,elections 2020
2427,"When Democrats are releasing violent criminals, encouraging illegal immigration, and passing laws to disarm you while turning the police into eunuchs, it’s over.",marriage equality
2428,"The typical occupations held by middle-class Americans have changed over the years, and a greater amount of all income generated has moved into the hands of individuals and households in the top shares of earners.",middle class
2429,"For the first time in its nearly century-and-a-half history, Wimbledon was canceled for a reason other than war, scrapped in 2020 on Wednesday because of the coronavirus pandemic.",sport
2430,Four major U.S. cities filed a lawsuit on Thursday contending that President Donald Trump’s administration is unconstitutionally seeking to undermine Obamacare by failing to faithfully execute the healthcare law.,universal health care
2431,"'Pandemic Apprentice': Deprived of rallies to inflate his ego, Trump muscles in on sickness and death",gun control
